{
  "schema_version": "1.0.0",
  "timestamp_utc": "20260401T101500Z",
  "proof_type": "self-check-result",
  "mode": "code",
  "subject": "self-check:payment-module",
  "result": "pass",
  "proof_hash": "112233445566",
  "proof": {
    "command": "review src/payment.py",
    "exit_code": 0
  },
  "self_check": {
    "files_reviewed": [
      {"path": "src/payment.py", "outcome": "pass"},
      {"path": "tests/test_payment.py", "outcome": "pass"}
    ],
    "red_flag_scan": "clean",
    "severity_counts": {
      "critical": 0,
      "important": 0,
      "minor": 1
    }
  }
}
